{
  "$schema": "https://miri-whl.github.io/schemas/lifecycle-v1.json",
  "miri_lifecycle_version": "0.1",
  "generated_at": "2026-01-01T00:00:00Z",
  "identity": {
    "purl": "pkg:pypi/requests@2.31.0",
    "distribution": "open-source",
    "registry": "https://pypi.org/simple/",
    "source_repository": "https://github.com/psf/requests"
  },
  "advisory_sources": [
    {
      "type": "osv",
      "ecosystem": "PyPI",
      "url": "https://api.osv.dev/v1/query",
      "authoritative": true
    }
  ],
  "update_check": {
    "type": "pypi-json",
    "url": "https://pypi.org/pypi/requests/json"
  },
  "support": {
    "status": "active",
    "supported_versions": [
      ">=2.0,<3.0"
    ],
    "eol_date": null,
    "replacement": null,
    "security_policy": "https://github.com/psf/requests/blob/main/SECURITY.md"
  },
  "vex": null
}
